product_id,review_text
kurta_001,"The fabric is great quality and the color is vibrant. Fits well."
kurta_001,"Looks beautiful, but the stitching is bad on the sleeves. Tore easily after one wash."
kurta_001,"Fast delivery! The material feels very good for the price."
saree_002,"Color faded after the first wash. Looks different from the picture. Very disappointed."
saree_002,"The material is very cheap. Not worth the money."
saree_002,"Received the wrong size, it was too small. The return process was okay."
bedsheet_003,"Excellent material and perfect fit for my bed. Looks great!"
bedsheet_003,"Delivery was on time and the product is exactly as described."
